{"type":"config","name":"Reduce Checkout Kit web production JavaScript","metricName":"js_bytes","metricUnit":"","bestDirection":"lower"}
{"run":1,"commit":"e82fffc","metric":0,"metrics":{"gzip_bytes":0},"status":"crash","description":"Baseline build could not start because platforms/web dependencies are not provisioned (vite not found).","timestamp":1790851500524,"segment":0}
{"run":2,"commit":"a821210","metric":42204,"metrics":{"gzip_bytes":11490},"status":"keep","description":"Fresh origin/main baseline after provisioning dependencies; standard web production build emitted one runtime file and passed declaration/manifest generation.","timestamp":1790851583601,"segment":0}
{"run":3,"commit":"9dd9782","metric":41895,"metrics":{"gzip_bytes":11458},"status":"keep","description":"Derive telemetry's protocol-method Set from the existing generated notification/request catalogs instead of emitting 15 duplicate wire-method strings. 42,204 -> 41,895 bytes; standard build and 75 TypeScript protocol tests passed.","timestamp":1790851672068,"segment":0}
{"run":4,"commit":"9dd9782","metric":0,"metrics":{"gzip_bytes":0},"status":"crash","description":"Expose individually tree-shakeable protocol descriptors and consume them directly in web. Build emitted 41,674 bytes but declaration generation reported stale protocol .d.ts exports, so the experiment is invalid until declarations are regenerated.","timestamp":1790851762175,"segment":0}
{"run":5,"commit":"9dd9782","metric":41914,"metrics":{"gzip_bytes":11411},"status":"discard","description":"Mark individually exported generated descriptors pure so Rollup can prune unused protocol request codecs. The result regressed the retained 41,895-byte bundle to 41,914 bytes, so discard the descriptor-export approach.","timestamp":1790851814046,"segment":0}
{"run":6,"commit":"bb01a98","metric":39058,"metrics":{"gzip_bytes":11139},"status":"keep","description":"Store only protocol wire names in the generated rename table and derive their camelCase TypeScript names during codec traversal, with codegen validation that every generated name is derivable. 41,895 -> 39,058 bytes; standard build and all 75 TypeScript protocol tests passed.","timestamp":1790851894845,"segment":0}
{"run":7,"commit":"bb01a98","metric":0,"metrics":{"gzip_bytes":0},"status":"crash","description":"Index generated protocol model references numerically, reducing the build to 37,029 bytes, but six internal codec tests still called the changed private runtime helper with model-name strings. Update those tests to use generated model IDs before evaluating.","timestamp":1790852006145,"segment":0}
{"run":8,"commit":"f79dfec0","metric":37029,"metrics":{"gzip_bytes":10900},"status":"keep","description":"Replace generated protocol model-name references and object keys with deterministic numeric model IDs while preserving labels for validation errors. 39,058 -> 37,029 bytes; standard build and all 75 TypeScript protocol tests passed.","timestamp":1790852061308,"segment":0}
{"run":9,"commit":"f79dfec","metric":71154,"metrics":{"gzip_bytes":13972},"status":"discard","description":"Explicitly use Vite's esbuild minifier to test whether it removes Rolldown region formatting. It produced 71,154 bytes versus 37,029, so keep the existing Oxc/default minifier.","timestamp":1790852129141,"segment":0}
{"run":10,"commit":"8a08156","metric":29397,"metrics":{"gzip_bytes":9750},"status":"keep","description":"Enable Oxc code generation in Rolldown's library output minifier. Vite 8 intentionally defaulted ES-library minification to compress/mangle without codegen, leaving formatting and region comments. 37,029 -> 29,397 bytes; standard build and all 302 web tests passed.","timestamp":1790852184093,"segment":0}
{"run":11,"commit":"8a08156","metric":29257,"metrics":{"gzip_bytes":9701},"status":"discard","description":"Expose generated protocol descriptors individually with valid pure annotations and have web consume only its nine handlers. It saved just 140 bytes (29,397 -> 29,257) while significantly expanding generated/public wiring, so discard as poor complexity-to-size tradeoff.","timestamp":1790852239716,"segment":0}
{"run":12,"commit":"c952296","metric":28402,"metrics":{"gzip_bytes":9844},"status":"keep","description":"Dictionary-encode repeated protocol wire field names and numeric-tag generated rename traversal nodes. 29,397 -> 28,402 bytes; gzip moved from 9,750 to 9,844 bytes, while standard build and all 75 TypeScript protocol tests passed.","timestamp":1790852295606,"segment":0}
{"run":13,"commit":"90ca324","metric":27610,"metrics":{"gzip_bytes":9889},"status":"keep","description":"Encode the generated protocol rename spine as a compact printable string and reconstruct it once in the codec runtime, with generator bounds validation and a late-model regression test. 28,402 -> 27,610 bytes; gzip moved from 9,844 to 9,889 bytes, standard build passed, and all 76 TypeScript protocol tests passed.","timestamp":1790852475847,"segment":0}
{"run":14,"commit":"90ca324","metric":27610,"metrics":{"gzip_bytes":9899},"status":"discard","description":"Join the generated wire-field dictionary into one delimiter-separated string and split at startup. Oxc produced identical 27,610-byte JavaScript and gzip worsened by 10 bytes, so discard.","timestamp":1790852544996,"segment":0}
{"run":15,"commit":"3b1b1b8","metric":27545,"metrics":{"gzip_bytes":9825},"status":"keep","description":"Decode compact rename-map symbols arithmetically from ASCII code points instead of shipping the 92-character encoding alphabet. 27,610 -> 27,545 bytes and gzip 9,889 -> 9,825 bytes; standard build and all 76 TypeScript protocol tests passed.","timestamp":1790852584709,"segment":0}
{"run":16,"commit":"1f88f2c","metric":27498,"metrics":{"gzip_bytes":9811},"status":"keep","description":"Unify telemetry export success and exception handling so measurement restoration, backoff updates, and active-request cleanup share one path; strengthen the failure test to verify restored measurements retry during shutdown. 27,545 -> 27,498 bytes and gzip 9,825 -> 9,811 bytes; standard build and all 13 telemetry tests passed.","timestamp":1790852631831,"segment":0}
{"run":17,"commit":"2e04beb","metric":27450,"metrics":{"gzip_bytes":9795},"status":"keep","description":"Make telemetry flush async so immediate stopped, empty, and backoff branches return booleans directly instead of constructing explicit resolved promises. 27,498 -> 27,450 bytes and gzip 9,811 -> 9,795 bytes; standard build and all 13 telemetry tests passed.","timestamp":1790852656797,"segment":0}
{"run":18,"commit":"38dbef7","metric":27432,"metrics":{"gzip_bytes":9794},"status":"keep","description":"Apply shared telemetry product/platform attributes inside the counter recorder instead of wrapping all three counter call sites. 27,450 -> 27,432 bytes and gzip 9,795 -> 9,794 bytes; standard build and all 13 telemetry tests passed.","timestamp":1790852677317,"segment":0}
{"run":19,"commit":"38dbef7","metric":27433,"metrics":{"gzip_bytes":9785},"status":"discard","description":"Inline shared product/platform attributes into the histogram and counter recording paths to remove the attribute helper. JavaScript regressed by 1 byte (27,432 -> 27,433), despite gzip improving by 9 bytes, so discard on the primary metric.","timestamp":1790852697036,"segment":0}
{"run":20,"commit":"e1ef614","metric":27387,"metrics":{"gzip_bytes":9786},"status":"keep","description":"Represent protocol codec traversal direction as a boolean instead of repeated decode/encode string values. 27,432 -> 27,387 bytes and gzip 9,794 -> 9,786 bytes; standard build and all 76 TypeScript protocol tests passed.","timestamp":1790852775564,"segment":0}
{"run":21,"commit":"e1ef614","metric":27357,"metrics":{"gzip_bytes":9768},"status":"discard","description":"Replace per-object rename lookup Maps with nested scans over rename entries. It saved only 30 bytes (27,387 -> 27,357) and 18 gzip bytes while changing traversal from indexed lookup to O(fields × entries), so discard the performance risk for a marginal gain.","timestamp":1790852802013,"segment":0}
{"run":22,"commit":"0faf133","metric":27357,"metrics":{"gzip_bytes":9770},"status":"keep","description":"Call the shared navigation-duration recorder directly at its two success/failure sites instead of retaining one-use private wrappers. 27,387 -> 27,357 bytes and gzip 9,786 -> 9,770 bytes; standard build and 112 focused web protocol/window tests passed. Also refresh the autoresearch experiment summary.","timestamp":1790852857819,"segment":0}
{"run":23,"commit":"7a95f83","metric":27839,"metrics":{"gzip_bytes":9963},"status":"keep","description":"Rebase the retained optimizations onto current main while preserving newly added ProtocolValidationError exports, own-property required-field checks, nested string validation, and undefined normalization. Current-main validation increased the retained bundle from 27,357 to 27,839 bytes, still below the 27.6 KiB stretch target; standard build and all 89 TypeScript protocol tests passed.","timestamp":1790853409847,"segment":0}
{"run":24,"commit":"5c233b6","metric":27953,"metrics":{"gzip_bytes":9998},"status":"discard","description":"Size-only comparison for operator-required review fixes: cache reusable rename lookups, support escaped base-91 integers through MAX_SAFE_INTEGER, and extract a pure decoder with synthetic compatibility tests. 27,839 -> 27,953 JS bytes; 9,963 -> 9,998 gzip bytes; standard build and 117 protocol tests passed. Not a size improvement, hence discard classification; DO NOT revert the code: these are explicitly approved correctness/performance fixes, retained independently of the optimization loop.","timestamp":1790855820068,"segment":0}
